Nome azienda;Ragione sociale;Attività;Indirizzo;Descrizione;Sito web;;Note;Referente;e-mail;tel.
AZIENDA AGRICOLA LA MADONNINA;SOC. AGR. LA MADONNINA DI PAVESI E GORGATTI S.S.;AGRITURISMO - CANTINA - PUNTO VENDITA;STRADA PILASTRO 29, 43010 TORRECHIARA (PR);L'agriturismo sorge ai piedi del Castello quattrocentesco di Torrechiara e davanti alla Badia Benedettina con un' estensione di 25 ettari coltivati prevalentemente a vigneti, tra cui la Termarina antico uva portata secondo la leggenda da Corinto al tempo delle Crociate. L'antico fienile datato 1906 ospita otto camere con pavimenti in legno, travi a vista e alle finestre le storiche gelosie. L'offerta gastronomica a disposizione del cliente vanta prodotti tipici della zona e piatti tradizionali.;www.la-madonnina.it;;Foto La Madonnina;ARIANNA ODDO;arianna.oddo89@gmail.com;335/8425385
Agriturismo Il Brugnolo;Agriturismo Il Brugnolo di Gatti ClaudiaV Sabatini 10 -42019 Scandiano RE P.IVA 01874890351 Cof Fisc GTTCLD63L62H223H;agriturismo (camere ed appartamenti);Via Sabatini 10, 42019 Scandiano RE;Situato nella zona pedecollinare tra Reggio e Modena, è una tipica casa contadina del 1800 in pietra a vista, circondata da un grande parco, campi e vigneti. Dispone di 3   appartamenti nel casale, di cui uno accessibile a sedie a rotelle, e 4 monolocali nella nuova struttura realizzata sul retro;www.ilbrugnolo.it;;foto Il Brugnolo;Claudia Gatti;info@ilbrugnolo.it;"3386305271; 0522.983980"
eGO eBIKE;di Fabio Zara;Bike Rental & Tour;via provinciale est 142 Nonantola (MO);Noleggio di biciclette, tradizionali e a pedalata assistita, con consegna e ritiro a domicilio (stazione, Hotel, ecc). Itinerari preconfezionati alla scoperta delle eccellenze di Modena e Provincia sia in libertà che guidati, in collaborazione con produttori ed attività commerciali della zona.;"www.egoebike.com;https://www.facebook.com/egoebike";;foto egobike;Fabio Zara;fabio.zara@egoebike.com;3483961274
Verde Natura srl;;Tour Operator;Via Don Primo Mazzolari 8 - 41012 Carpi (mo);Tour operator dal 1985, specializzato nell'organizzazione di facili vacanze in bici, viaggi in bicicletta, bici e barca, trekking, Walking, per individuali, gruppi, famiglie, tour in libertà e con accompagnatore.;http://www.verde-natura.it;;logo ;Riccardo Sedola;r.sedola@verde-natura.com;338 7848453
RICCIONE TERME SPA;;Centro Termale;Viale Torino, 4/16 - 47838 RICCIONE;"Riccione Terme propone bagni sulfurei con il mare e il sole come scenario.;Centro Termale, Percorso Termale Sensoriale, Centro Benessere, Centro Riabilitativo ";www.riccioneterme.it;;Foto Riccione Terme Percorso Termale sensoriale getti a cascata;Raffaella Brigidi;"info@riccioneterme.it; direzione@riccioneterme.it";0541 602201
PERLE D'ACQUA PARK;;Parco del Benessere Termale all'aperto;Viale Torino, 16 - 47838 RICCIONE;Parco del Benessere Termale all'aperto con piscine, vasche colorate, percorsi rivitalizzanti con acqua termale, area bimbi attrezzata;www.perledacqua.it;;Foto Perle d'Acqua Park cascate cromatiche;Raffaella Brigidi;info@perledacqua.it;0541 697162
